{
  "contract_id": "SF-CON-SEARCH-DOCUMENT",
  "contract_status": "FROZEN",
  "freeze_status": "FROZEN",
  "tenant_id": "11111111-1111-4111-8111-111111111111",
  "document_id": "22222222-2222-4222-8222-222222222222",
  "source_cmp_id": "CMP-015",
  "source_record_id": "33333333-3333-4333-8333-333333333333",
  "facets": {
    "service_code": "RESIDENCE_CERTIFICATE",
    "state": "SUBMITTED"
  },
  "tenant_scope_required": true,
  "cross_tenant_fields_forbidden": true,
  "connector_mode": "SANDBOX"
}
